{
  "id": "01JAAAAAAAAAAAAAAAAAAAAAAA",
  "jurisdiction_id": "lu-commune-esch-sur-alzette",
  "topic_ids": ["example.parks"],
  "title": { "en": "Example idea title" },
  "text": { "en": "Example idea text: a synthetic proposal, not a real one." },
  "proposer_nym": "example-nym-proposer-a",
  "created_at": "2026-10-06T09:00:00.000000Z",
  "scope_tier": "local",
  "charter_version": "0.1.0",
  "upvote_count": null
}
